{
  "id": "01JBQ0ARB1TRAGE0000000000D",
  "item_id": "YARYX9NM753C0AF6CDVVE6SVGN",
  "lot_id": "lot-003",
  "item_version": 1,
  "item_empreinte": "76ae5a1406b53af518d9c2dce5e7381bbb62d25df353a2a1b5614f00c87587d2",
  "motif": "desaccord",
  "issue": "non_evaluable",
  "arbitre": "panel",
  "arbitre_seul": true,
  "motivation": "La position est formulée au conditionnel sans engagement : non évaluable.",
  "date": "2026-09-22T09:00:00+02:00"
}
