{
  "id": "01JBQ0ARB1TRAGE0000000000A",
  "item_id": "YARYX9NM753C0AF6CDVVE6SVGN",
  "lot_id": "lot-003",
  "item_version": 1,
  "item_empreinte": "76ae5a1406b53af518d9c2dce5e7381bbb62d25df353a2a1b5614f00c87587d2",
  "motif": "desaccord",
  "issue": "verifie",
  "contenu_retenu": "original",
  "arbitre": "auteur",
  "arbitre_seul": false,
  "motivation": "La citation figure page 14 de la source archivée ; le rejet reposait sur une page mal lue.",
  "date": "2026-09-22T09:00:00+02:00"
}
